Day of Week,Date,d1,d2,Event,Date Wikipedia,Event Wikipedia,Date UFC,Event UFC,Date Sherdog,Event Sherdog,Date Fightmetric,Event Fightmetric,Date MMAFighting,Event MMAFighting
Saturday,2017-12-30,False,False,UFC 219: Cyborg vs. Holm,12/30/2017,UFC 219: Cyborg vs. Holm,12/30/2017,,12/30/2017,UFC 219 - Cyborg vs. Holm,12/30/2017,,12/30/2017,UFC 219
Saturday,2017-12-16,False,False,UFC on Fox: Lawler vs. dos Anjos,12/16/2017,UFC on Fox: Lawler vs. dos Anjos,12/16/2017,,12/16/2017,UFC on Fox 26 - Lawler vs. dos Anjos,12/16/2017,UFC Fight Night: Lawler vs. Dos Anjos,12/16/2017,UFC on FOX 26
Saturday,2017-12-09,False,False,UFC Fight Night: Swanson vs. Ortega,12/9/2017,UFC Fight Night: Swanson vs. Ortega,12/9/2017,UFC Fight Night - Swanson vs Ortega,12/9/2017,,12/9/2017,UFC Fight Night: Swanson vs. Ortega,12/9/2017,"UFC Fresno, results"
Saturday,2017-12-02,False,False,UFC 218: Holloway vs. Aldo 2,12/2/2017,UFC 218: Holloway vs. Aldo 2,12/2/2017,UFC 218 - Holloway vs Aldo 2,12/2/2017,UFC 218 - Holloway vs. Aldo 2,12/2/2017,UFC 218: Holloway vs. Aldo 2,12/2/2017,UFC 218
,2017-12-01,False,False,The Ultimate Fighter Finale: Montano vs Modafferi,12/1/2017,The Ultimate Fighter: A New World Champion Finale,12/1/2017,The Ultimate Fighter Finale - Montano vs Modafferi,12/1/2017,,12/1/2017,The Ultimate Fighter 26 Finale,12/1/2017,
Saturday,2017-11-25,False,False,UFC Fight Night: Bisping vs. Gastelum,11/25/2017,UFC Fight Night: Bisping vs. Gastelum,11/25/2017,UFC Fight Night - Bisping vs Gastelum,11/25/2017,UFC Fight Night 122 - Bisping vs. Gastelum,11/25/2017,UFC Fight Night: Bisping vs. Gastelum,11/25/2017,UFC Shanghai
Saturday,2017-11-18,False,False,UFC Fight Night: Werdum vs. Tybura,11/19/2017,UFC Fight Night: Werdum vs. Tybura,11/18/2017,UFC Fight Night - Werdum vs Tybura,11/18/2017,,11/18/2017,UFC Fight Night: Werdum vs. Tybura,11/18/2017,UFC Sydney
Saturday,2017-11-11,False,False,UFC Fight Night: Poirier vs. Pettis,11/11/2017,UFC Fight Night: Poirier vs. Pettis,11/11/2017,UFC Fight Night - Poirier vs Pettis,11/11/2017,UFC Fight Night 120 - Poirier vs. Pettis,11/11/2017,UFC Fight Night: Poirier vs. Pettis,11/11/2017,"UFC Norfolk, results: One fighter misses weight"
Saturday,2017-11-04,False,False,UFC 217: Bisping vs. St-Pierre,11/4/2017,UFC 217: Bisping vs. St-Pierre,11/4/2017,UFC 217 - Bisping vs St-Pierre,11/4/2017,,11/4/2017,UFC 217: Bisping vs. St-Pierre,11/4/2017,UFC 217
Saturday,2017-10-28,False,False,UFC Fight Night: Brunson vs. Machida,10/28/2017,UFC Fight Night: Brunson vs. Machida,10/28/2017,UFC Fight Night - Brunson vs Machida,10/28/2017,UFC Fight Night 119 - Brunson vs. Machida,10/28/2017,UFC Fight Night: Brunson vs. Machida,10/28/2017,UFC Sao Paulo
Saturday,2017-10-21,False,False,UFC Fight Night: Cerrone vs. Till,10/21/2017,UFC Fight Night: Cerrone vs. Till,10/21/2017,UFC Fight Night - Cerrone vs Till,10/21/2017,,10/21/2017,UFC Fight Night: Cerrone vs. Till,10/21/2017,"UFC Gdansk, results"
Saturday,2017-10-07,False,False,UFC 216: Ferguson vs. Lee,10/7/2017,UFC 216: Ferguson vs. Lee,10/7/2017,UFC 216 - Ferguson vs. Lee,10/7/2017,UFC 216 - Ferguson vs. Lee,10/7/2017,UFC 216: Ferguson vs. Lee,10/7/2017,UFC 216
Friday,2017-09-22,False,False,UFC Fight Night: Saint Preux vs. Okami,9/23/2017,UFC Fight Night: Saint Preux vs. Okami,9/22/2017,UFC Fight Night - Saint Preux vs Okami,9/22/2017,,9/22/2017,UFC Fight Night: Saint Preux vs. Okami,9/22/2017,"UFC Japan, results: Mizuto Hirota misses weight"
Saturday,2017-09-16,False,True,UFC Fight Night: Rockhold vs. Branch,9/16/2017,UFC Fight Night: Rockhold vs. Branch,9/16/2017,UFC Fight Night - Rockhold vs Branch,9/16/2017,UFC Fight Night 116 - Rockhold vs. Branch,9/16/2017,UFC Fight Night: Rockhold vs. Branch,9/16/2017,"UFC Pittsburgh, results"
Saturday,2017-09-09,False,False,UFC 215: Nunes vs. Shevchenko 2,9/9/2017,UFC 215: Nunes vs. Shevchenko 2,9/9/2017,UFC 215 - Nunes vs Shevchenko 2,9/9/2017,,9/9/2017,UFC 215: Nunes vs Shevchenko 2,9/9/2017,UFC 215
Saturday,2017-09-02,False,False,UFC Fight Night: Volkov vs. Struve,9/2/2017,UFC Fight Night: Volkov vs. Struve,9/2/2017,UFC Fight Night - Volkov vs Struve,9/2/2017,UFC Fight Night 115 - Volkov vs. Struve,9/2/2017,UFC Fight Night: Volkov vs. Struve,9/2/2017,"UFC Rotterdam, results"
Saturday,2017-08-05,False,False,UFC Fight Night: Pettis vs. Moreno,8/5/2017,UFC Fight Night: Pettis vs. Moreno,8/5/2017,UFC Fight Night - Pettis vs Moreno,8/5/2017,,8/5/2017,UFC Fight Night: Pettis vs. Moreno,8/5/2017,UFC Fight Night 114 weigh-in results: Alexa Grasso misses weight
Saturday,2017-07-29,False,False,UFC 214: Cormier vs. Jones 2,7/29/2017,UFC 214: Cormier vs. Jones 2,7/29/2017,UFC 214 - Cormier vs Jones 2,7/29/2017,UFC 214 - Cormier vs. Jones 2,7/29/2017,UFC 214: Cormier vs. Jones 2,7/29/2017,UFC 214
Saturday,2017-07-22,False,False,UFC on Fox: Weidman vs. Gastelum,7/22/2017,UFC on Fox: Weidman vs. Gastelum,7/22/2017,UFC Fight Night - Weidman vs Gastelum,7/22/2017,,7/22/2017,UFC Fight Night: Weidman vs. Gastelum,7/22/2017,UFC on FOX 25
Sunday,2017-07-16,False,False,UFC Fight Night: Nelson vs. Ponzinibbio,7/16/2017,UFC Fight Night: Nelson vs. Ponzinibbio,7/16/2017,UFC Fight Night - Nelson vs Ponzinibbio,7/16/2017,UFC Fight Night 113 - Nelson vs. Ponzinibbio,7/16/2017,UFC Fight Night: Nelson vs. Ponzinibbio,7/16/2017,UFC Fight Night 113
Saturday,2017-07-08,False,False,UFC 213: Romero vs. Whittaker,7/8/2017,UFC 213: Romero vs. Whittaker,7/8/2017,UFC 213 - Romero vs Whittaker,7/8/2017,,7/8/2017,UFC 213: Romero vs. Whittaker,7/8/2017,UFC 213
Friday,2017-07-07,False,False,The Ultimate Fighter: Redemption Finale,7/7/2017,The Ultimate Fighter: Redemption Finale,7/7/2017,The Ultimate Fighter Finale - Johnson vs Gaethje,7/7/2017,UFC - The Ultimate Fighter 25 Finale,7/7/2017,The Ultimate Fighter 25 Finale,7/7/2017,TUF 25 Finale
Sunday,2017-06-25,False,False,UFC Fight Night: Chiesa vs. Lee,6/25/2017,UFC Fight Night: Chiesa vs. Lee,6/25/2017,UFC Fight Night - Chiesa vs Lee,6/25/2017,,6/25/2017,UFC Fight Night: Chiesa vs. Lee,6/25/2017,Johny Hendricks misses weight (again) at UFC Fight Night 112 weigh-ins
Saturday,2017-06-17,False,False,UFC Fight Night: Holm vs. Correia,6/17/2017,UFC Fight Night: Holm vs. Correia,6/17/2017,UFC Fight Night - Holm vs Correia,6/17/2017,UFC Fight Night 111 - Holm vs. Correia,6/17/2017,UFC Fight Night: Holm vs. Correia,6/17/2017,UFC Fight Night 111
Saturday,2017-06-10,False,False,UFC Fight Night: Lewis vs. Hunt,6/11/2017,UFC Fight Night: Lewis vs. Hunt,6/10/2017,UFC Fight Night - Lewis vs Hunt,6/10/2017,,6/10/2017,UFC Fight Night: Lewis vs. Hunt,6/10/2017,UFC Fight Night 110
Saturday,2017-06-03,False,False,UFC 212: Aldo vs. Holloway,6/3/2017,UFC 212: Aldo vs. Holloway,6/3/2017,UFC 212 - Aldo vs Holloway,6/3/2017,UFC 212 - Aldo vs. Holloway,6/3/2017,UFC 212: Aldo vs. Holloway,6/3/2017,UFC 212
Sunday,2017-05-28,False,False,UFC Fight Night: Gustafsson vs. Teixeira,5/28/2017,UFC Fight Night: Gustafsson vs. Teixeira,5/28/2017,UFC Fight Night - Gustafsson vs Teixeira,5/28/2017,,5/28/2017,UFC Fight Night: Gustafsson vs. Teixeira,5/28/2017,UFC Fight Night 109
Saturday,2017-05-13,False,False,UFC 211: Miocic vs. dos Santos 2,5/13/2017,UFC 211: Miocic vs. dos Santos 2,5/13/2017,UFC 211 - Miocic vs Dos Santos 2,5/13/2017,UFC 211 - Miocic vs. Dos Santos 2,5/13/2017,UFC 211: Miocic vs. Dos Santos,5/13/2017,UFC 211
Saturday,2017-04-22,False,False,UFC Fight Night: Swanson vs. Lobov,4/22/2017,UFC Fight Night: Swanson vs. Lobov,4/22/2017,UFC Fight Night - Swanson vs. Lobov,4/22/2017,,4/22/2017,UFC Fight Night: Swanson vs. Lobov,4/22/2017,UFC Fight Night 108
Saturday,2017-04-15,False,False,UFC on Fox: Johnson vs. Reis,4/15/2017,UFC on Fox: Johnson vs. Reis,4/15/2017,UFC Fight Night - Johnson vs Reis,4/15/2017,UFC on Fox 24 - Johnson vs. Reis,4/15/2017,UFC Fight Night: Johnson vs. Reis,4/15/2017,UFC on FOX 24
Saturday,2017-04-08,False,False,UFC 210: Cormier vs. Johnson 2,4/8/2017,UFC 210: Cormier vs. Johnson 2,4/8/2017,UFC 210 - Cormier vs Johnson 2,4/8/2017,,4/8/2017,UFC 210: Cormier vs. Johnson 2,4/8/2017,UFC 210
Saturday,2017-03-18,False,False,UFC Fight Night: Manuwa vs. Anderson,3/18/2017,UFC Fight Night: Manuwa vs. Anderson,3/18/2017,UFC Fight Night - Manuwa vs Anderson,3/18/2017,UFC Fight Night 107 - Manuwa vs. Anderson,3/18/2017,UFC Fight Night: Manuwa vs. Anderson,3/18/2017,UFC Fight Night 107
Saturday,2017-03-11,False,False,UFC Fight Night: Belfort vs. Gastelum,3/11/2017,UFC Fight Night: Belfort vs. Gastelum,3/11/2017,UFC Fight Night - Belfort vs Gastelum,3/11/2017,,3/11/2017,UFC Fight Night: Belfort vs. Gastelum,3/11/2017,UFC Fight Night 106
Saturday,2017-03-04,False,False,UFC 209: Woodley vs. Thompson 2,3/4/2017,UFC 209: Woodley vs. Thompson 2,3/4/2017,UFC 209 - Woodley vs Thompson 2,3/4/2017,UFC 209 - Woodley vs. Thompson 2,3/4/2017,UFC 209: Woodley vs. Thompson 2,3/4/2017,UFC 209
Sunday,2017-02-19,False,False,UFC Fight Night: Lewis vs. Browne,2/19/2017,UFC Fight Night: Lewis vs. Browne,2/19/2017,UFC Fight Night - Lewis vs Browne,2/19/2017,,2/19/2017,UFC Fight Night: Lewis vs. Browne,2/19/2017,UFC Fight Night 105
Saturday,2017-02-11,False,False,UFC 208: Holm vs. de Randamie,2/11/2017,UFC 208: Holm vs. de Randamie,2/11/2017,UFC 208 - Holm vs de Randamie,2/11/2017,UFC 208 - Holm vs. De Randamie,2/11/2017,UFC 208: Holm vs. De Randamie,2/11/2017,UFC 208
Saturday,2017-02-04,False,False,UFC Fight Night: Bermudez vs. Korean Zombie,2/4/2017,UFC Fight Night: Bermudez vs. Korean Zombie,2/4/2017,UFC Fight Night - Bermudez vs Korean Zombie,2/4/2017,,2/4/2017,UFC Fight Night: Bermudez vs. The Korean Zombie,2/4/2017,Bec Rawlings explains why she missed weight at UFC Fight Night 104
Saturday,2017-01-28,False,False,UFC on Fox: Shevchenko vs. Pea,1/28/2017,UFC on Fox: Shevchenko vs. Pea,1/28/2017,UFC Fight Night - Shevchenko vs Pena,1/28/2017,UFC on Fox 23 - Shevchenko vs. Pena,1/28/2017,UFC Fight Night: Shevchenko vs. Pena,1/28/2017,UFC on FOX 23
Sunday,2017-01-15,False,False,UFC Fight Night: Rodrguez vs. Penn,1/15/2017,UFC Fight Night: Rodrguez vs. Penn,1/15/2017,UFC Fight Night - Rodriguez vs Penn,1/15/2017,,1/15/2017,UFC Fight Night: Rodriguez vs. Penn,1/15/2017,UFC Fight Night 103
Friday,2016-12-30,False,False,UFC 207: Nunes vs. Rousey,12/30/2016,UFC 207: Nunes vs. Rousey,12/30/2016,UFC 207 - Nunes vs Rousey,12/30/2016,UFC 207 - Nunes vs. Rousey,12/30/2016,UFC 207: Nunes vs. Rousey,12/30/2016,
Saturday,2016-12-17,False,False,UFC on Fox: VanZant vs. Waterson,12/17/2016,UFC on Fox: VanZant vs. Waterson,12/17/2016,UFC Fight Night - VanZant vs Waterson,12/17/2016,,12/17/2016,UFC Fight Night: VanZant vs. Waterson,12/17/2016,UFC on FOX 22
Saturday,2016-12-10,False,False,UFC 206: Holloway vs. Pettis,12/10/2016,UFC 206: Holloway vs. Pettis,12/10/2016,UFC 206 - Holloway vs Pettis,12/10/2016,UFC 206 - Holloway vs. Pettis,12/10/2016,UFC 206: Holloway vs. Pettis,12/10/2016,UFC 206
Friday,2016-12-09,False,False,UFC Fight Night: Lewis vs. Abdurakhimov,12/9/2016,UFC Fight Night: Lewis vs. Abdurakhimov,12/9/2016,UFC Fight Night - Lewis vs Abdurakhimov,12/9/2016,,12/9/2016,UFC Fight Night: Lewis vs. Abdurakhimov,12/9/2016,
Saturday,2016-12-03,False,False,The Ultimate Fighter: Tournament of Champions Finale,12/3/2016,The Ultimate Fighter: Tournament of Champions Finale,12/3/2016,The Ultimate Fighter - A Tournament of Champions Finale,12/3/2016,UFC - The Ultimate Fighter 24 Finale,12/3/2016,The Ultimate Fighter 24 Finale,12/3/2016,TUF 24 Finale
Saturday,2016-11-26,False,False,UFC Fight Night: Whittaker vs. Brunson,11/27/2016,UFC Fight Night: Whittaker vs. Brunson,11/26/2016,UFC Fight Night - Whittaker vs Brunson,11/26/2016,,11/26/2016,UFC Fight Night: Whittaker vs. Brunson,11/26/2016,UFC Fight Night 101
Saturday,2016-11-19,True,True,UFC Fight Night: Mousasi vs. Hall 2,11/19/2016,UFC Fight Night: Mousasi vs. Hall 2,11/19/2016,UFC Fight Night - Mousasi vs Hall 2,11/19/2016,,11/19/2016,UFC Fight Night: Mousasi vs. Hall 2,11/19/2016,UFC Fight Night 99
Saturday,2016-11-19,True,True,UFC Fight Night: Bader vs. Nogueira 2,11/19/2016,UFC Fight Night: Bader vs. Nogueira 2,11/19/2016,UFC Fight Night - Bader vs Nogueira 2,11/19/2016,UFC Fight Night 100 - Bader vs. Nogueira 2,11/19/2016,UFC Fight Night: Bader vs. Nogueira,11/19/2016,UFC Fight Night 100
Saturday,2016-11-12,False,False,UFC 205: Alvarez vs. McGregor,11/12/2016,UFC 205: Alvarez vs. McGregor,11/12/2016,UFC 205 - Alvarez vs McGregor,11/12/2016,UFC 205 - Alvarez vs. McGregor,11/12/2016,UFC 205: Alvarez vs McGregor,11/12/2016,UFC 205
Saturday,2016-11-05,False,False,The Ultimate Fighter Latin America 3 Finale: dos Anjos vs. Ferguson,11/5/2016,The Ultimate Fighter Latin America 3 Finale: dos Anjos vs. Ferguson,11/5/2016,UFC Fight Night - Dos Anjos vs Ferguson,11/5/2016,,11/5/2016,UFC Fight Night: Dos Anjos vs. Ferguson,11/5/2016,UFC Fight Night 98
Saturday,2016-10-15,False,False,UFC Fight Night: Lamas vs. Penn,10/15/2016,UFC Fight Night: Lamas vs. Penn,10/15/2016,,10/15/2016,,10/15/2016,,10/15/2016,
Saturday,2016-10-08,False,False,UFC 204: Bisping vs. Henderson 2,10/8/2016,UFC 204: Bisping vs. Henderson 2,10/8/2016,UFC 204 - Bisping vs Henderson,10/8/2016,UFC 204 - Bisping vs. Henderson 2,10/8/2016,UFC 204: Bisping vs. Henderson,10/8/2016,UFC 204
Saturday,2016-10-01,False,False,UFC Fight Night: Lineker vs. Dodson,10/1/2016,UFC Fight Night: Lineker vs. Dodson,10/1/2016,UFC Fight Night - Lineker vs Dodson,10/1/2016,,10/1/2016,UFC Fight Night: Lineker vs. Dodson,10/1/2016,UFC Fight Night 96
Saturday,2016-09-24,False,False,UFC Fight Night: Cyborg vs. Lansberg,9/24/2016,UFC Fight Night: Cyborg vs. Lansberg,9/24/2016,UFC Fight Night - Cyborg vs Lansberg,9/24/2016,UFC Fight Night 95 - Cyborg vs. Lansberg,9/24/2016,UFC Fight Night: Cyborg vs. Lansberg,9/24/2016,UFC Fight Night 95
Saturday,2016-09-17,False,False,UFC Fight Night: Poirier vs. Johnson,9/17/2016,UFC Fight Night: Poirier vs. Johnson,9/17/2016,UFC Fight Night - Poirier vs Johnson,9/17/2016,,9/17/2016,UFC Fight Night: Poirier vs. Johnson,9/17/2016,UFC Fight Night 94
Saturday,2016-09-10,False,False,UFC 203: Miocic vs. Overeem,9/10/2016,UFC 203: Miocic vs. Overeem,9/10/2016,UFC 203 - Miocic vs. Overeem,9/10/2016,UFC 203 - Miocic vs. Overeem,9/10/2016,UFC 203: Miocic vs. Overeem,9/10/2016,UFC 203
Saturday,2016-09-03,False,False,UFC Fight Night: Arlovski vs. Barnett,9/3/2016,UFC Fight Night: Arlovski vs. Barnett,9/3/2016,UFC Fight Night - Arlovski vs Barnett,9/3/2016,,9/3/2016,UFC Fight Night: Arlovski vs. Barnett,9/3/2016,UFC Fight Night 93
Saturday,2016-08-27,False,False,UFC on Fox: Maia vs. Condit,8/27/2016,UFC on Fox: Maia vs. Condit,8/27/2016,UFC Fight Night - Maia vs Condit,8/27/2016,UFC on Fox 21 - Maia vs. Condit,8/27/2016,UFC Fight Night: Maia vs. Condit,8/27/2016,UFC on FOX 21
Saturday,2016-08-20,False,False,UFC 202: Diaz vs. McGregor 2,8/20/2016,UFC 202: Diaz vs. McGregor 2,8/20/2016,UFC 202 - Diaz vs McGregor 2,8/20/2016,,8/20/2016,UFC 202: Diaz vs. McGregor 2,8/20/2016,"UFC 202, results"
Saturday,2016-08-06,False,False,UFC Fight Night: Rodrguez vs. Caceres,8/6/2016,UFC Fight Night: Rodrguez vs. Caceres,8/6/2016,UFC Fight Night - Rodriguez vs Caceres,8/6/2016,UFC Fight Night 92 - Rodriguez vs. Caceres,8/6/2016,UFC Fight Night: Rodriguez vs. Caceres,8/6/2016,UFC Fight Night 92
Saturday,2016-07-30,False,False,UFC 201: Lawler vs. Woodley,7/30/2016,UFC 201: Lawler vs. Woodley,7/30/2016,UFC 201 - Lawler vs. Woodley,7/30/2016,,7/30/2016,UFC 201: Lawler vs. Woodley,7/30/2016,UFC 201
Saturday,2016-07-23,False,False,UFC on Fox: Holm vs. Shevchenko,7/23/2016,UFC on Fox: Holm vs. Shevchenko,7/23/2016,UFC Fight Night - Holm vs Shevchenko,7/23/2016,UFC on Fox 20 - Holm vs. Shevchenko,7/23/2016,UFC Fight Night: Holm vs. Shevchenko,7/23/2016,UFC on FOX 20
Wednesday,2016-07-13,False,False,UFC Fight Night: McDonald vs. Lineker,7/13/2016,UFC Fight Night: McDonald vs. Lineker,7/13/2016,UFC Fight Night - McDonald vs Lineker,7/13/2016,,7/13/2016,UFC Fight Night: McDonald vs. Lineker,7/13/2016,"UFC Fight Night 91, results"
Saturday,2016-07-09,False,False,UFC 200: Tate vs. Nunes,7/9/2016,UFC 200: Tate vs. Nunes,7/9/2016,UFC 200 - Tate vs Nunes,7/9/2016,UFC 200 - Tate vs. Nunes,7/9/2016,UFC 200: Tate vs Nunes,7/9/2016,UFC 200
Friday,2016-07-08,False,False,The Ultimate Fighter: Team Joanna vs. Team Cludia Finale,7/8/2016,The Ultimate Fighter: Team Joanna vs. Team Cludia Finale,7/8/2016,The Ultimate Fighter Finale - Team Joanna vs. Team Claudia,7/8/2016,,7/8/2016,The Ultimate Fighter 23 Finale,7/8/2016,TUF 23 Finale
Thursday,2016-07-07,False,False,UFC Fight Night: dos Anjos vs. Alvarez,7/7/2016,UFC Fight Night: dos Anjos vs. Alvarez,7/7/2016,UFC Fight Night - Dos Anjos vs. Alvarez,7/7/2016,UFC Fight Night 90 - Dos Anjos vs. Alvarez,7/7/2016,UFC Fight Night: Dos Anjos vs. Alvarez,7/7/2016,UFC Fight Night 90
Saturday,2016-06-18,False,False,UFC Fight Night: MacDonald vs. Thompson,6/18/2016,UFC Fight Night: MacDonald vs. Thompson,6/18/2016,UFC Fight Night - MacDonald vs. Thompson,6/18/2016,,6/18/2016,UFC Fight Night: MacDonald vs Thompson,6/18/2016,UFC Fight Night 89
Saturday,2016-06-04,False,False,UFC 199: Rockhold vs. Bisping 2,6/4/2016,UFC 199: Rockhold vs. Bisping 2,6/4/2016,UFC 199 - Rockhold vs. Bisping 2,6/4/2016,UFC 199 - Rockhold vs. Bisping 2,6/4/2016,UFC 199: Rockhold vs. Bisping 2,6/4/2016,UFC 199
Sunday,2016-05-29,False,False,UFC Fight Night: Almeida vs. Garbrandt,5/29/2016,UFC Fight Night: Almeida vs. Garbrandt,5/29/2016,UFC Fight Night - Almeida vs. Garbrandt,5/29/2016,,5/29/2016,UFC Fight Night: Almeida vs Garbrandt,5/29/2016,UFC Fight Night 88
Saturday,2016-05-14,False,False,UFC 198: Werdum vs. Miocic,5/14/2016,UFC 198: Werdum vs. Miocic,5/14/2016,UFC 198 - Werdum vs. Miocic,5/14/2016,UFC 198 - Werdum vs. Miocic,5/14/2016,UFC 198: Werdum vs Miocic,5/14/2016,UFC 198
Sunday,2016-05-08,False,False,UFC Fight Night: Overeem vs. Arlovski,5/8/2016,UFC Fight Night: Overeem vs. Arlovski,5/8/2016,UFC Fight Night - Overeem vs. Arlovski,5/8/2016,,5/8/2016,UFC Fight Night: Overeem vs Arlovski,5/8/2016,UFC Fight Night 87
Saturday,2016-04-23,False,False,UFC 197: Jones vs. Saint Preux,4/23/2016,UFC 197: Jones vs. Saint Preux,4/23/2016,UFC 197 - Jones vs. Saint Preux,4/23/2016,UFC 197 - Jones vs. St. Preux,4/23/2016,UFC 197: Jones vs Saint Preux,4/23/2016,UFC 197
Saturday,2016-04-16,False,False,UFC on Fox: Teixeira vs. Evans,4/16/2016,UFC on Fox: Teixeira vs. Evans,4/16/2016,UFC Fight Night - Teixeira vs. Evans,4/16/2016,,4/16/2016,UFC Fight Night: Teixeira vs Evans,4/16/2016,UFC on FOX 19
Sunday,2016-04-10,False,False,UFC Fight Night: Rothwell vs. dos Santos,4/10/2016,UFC Fight Night: Rothwell vs. dos Santos,4/10/2016,UFC Fight Night - Rothwell vs. Dos Santos,4/10/2016,UFC Fight Night 86 - Rothwell vs. Dos Santos,4/10/2016,UFC Fight Night: Rothwell vs Dos Santos,4/10/2016,UFC Fight Night 86
Saturday,2016-03-19,False,False,UFC Fight Night: Hunt vs. Mir,3/20/2016,UFC Fight Night: Hunt vs. Mir,3/19/2016,UFC Fight Night - Hunt vs. Mir,3/19/2016,,3/19/2016,UFC Fight Night: Hunt vs Mir,3/19/2016,UFC Fight Night 85
Saturday,2016-03-05,False,False,UFC 196: McGregor vs. Diaz,3/5/2016,UFC 196: McGregor vs. Diaz,3/5/2016,UFC 196 - McGregor vs. Diaz,3/5/2016,UFC 196 - McGregor vs. Diaz,3/5/2016,UFC 196: McGregor vs Diaz,3/5/2016,UFC 196
Saturday,2016-02-27,False,False,UFC Fight Night: Silva vs. Bisping,2/27/2016,UFC Fight Night: Silva vs. Bisping,2/27/2016,UFC Fight Night - Silva vs. Bisping,2/27/2016,,2/27/2016,UFC Fight Night: Silva vs Bisping,2/27/2016,UFC Fight Night 84
Sunday,2016-02-21,False,False,UFC Fight Night: Cowboy vs. Cowboy,2/21/2016,UFC Fight Night: Cowboy vs. Cowboy,2/21/2016,UFC Fight Night - Cowboy vs. Cowboy,2/21/2016,UFC Fight Night 83 - Cerrone vs. Oliveira,2/21/2016,UFC Fight Night: Cowboy vs Cowboy,2/21/2016,UFC Fight Night 83
Saturday,2016-02-06,False,False,UFC Fight Night: Hendricks vs. Thompson,2/6/2016,UFC Fight Night: Hendricks vs. Thompson,2/6/2016,UFC Fight Night - Hendricks vs. Thompson,2/6/2016,,2/6/2016,UFC Fight Night: Hendricks vs Thompson,2/6/2016,UFC Fight Night 82
Saturday,2016-01-30,False,False,UFC on Fox: Johnson vs. Bader,1/30/2016,UFC on Fox: Johnson vs. Bader,1/30/2016,UFC Fight Night - Johnson vs. Bader,1/30/2016,UFC on Fox 18 - Johnson vs. Bader,1/30/2016,UFC Fight Night: Johnson vs. Bader,1/30/2016,UFC on FOX 18
Sunday,2016-01-17,False,False,UFC Fight Night: Dillashaw vs. Cruz,1/17/2016,UFC Fight Night: Dillashaw vs. Cruz,1/17/2016,UFC Fight Night - Dillashaw vs. Cruz,1/17/2016,,1/17/2016,UFC Fight Night: Dillashaw vs Cruz,1/17/2016,UFC Fight Night 81
Saturday,2016-01-02,False,False,UFC 195: Lawler vs. Condit,1/2/2016,UFC 195: Lawler vs. Condit,1/2/2016,UFC 195 - Lawler vs Condit,1/2/2016,UFC 195 - Lawler vs. Condit,1/2/2016,UFC 195: Lawler vs Condit,1/2/2016,UFC 195
Saturday,2015-12-19,False,False,UFC on Fox: dos Anjos vs. Cerrone 2,12/19/2015,UFC on Fox: dos Anjos vs. Cerrone 2,12/19/2015,UFC Fight Night - dos Anjos vs Cowboy 2,12/19/2015,,12/19/2015,UFC on FOX: Dos Anjos vs. Cowboy 2,12/19/2015,UFC on FOX 17
Saturday,2015-12-12,False,False,UFC 194: Aldo vs. McGregor,12/12/2015,UFC 194: Aldo vs. McGregor,12/12/2015,UFC 194 - Aldo vs McGregor,12/12/2015,UFC 194 - Aldo vs. McGregor,12/12/2015,UFC 194: Aldo vs McGregor,12/12/2015,
Friday,2015-12-11,False,False,The Ultimate Fighter: Team McGregor vs. Team Faber Finale,12/11/2015,The Ultimate Fighter: Team McGregor vs. Team Faber Finale,12/11/2015,The Ultimate Fighter Finale - Team McGregor vs Team Faber,12/11/2015,,12/11/2015,The Ultimate Fighter 22 Finale,12/11/2015,TUF 22 Finale
Thursday,2015-12-10,False,False,UFC Fight Night: Namajunas vs. VanZant,12/10/2015,UFC Fight Night: Namajunas vs. VanZant,12/10/2015,UFC Fight Night - Namajunas vs VanZant,12/10/2015,UFC Fight Night 80 - Namajunas vs. VanZant,12/10/2015,UFC Fight Night: Namajunas vs. VanZant,12/10/2015,
Saturday,2015-11-28,False,False,UFC Fight Night: Henderson vs. Masvidal,11/28/2015,UFC Fight Night: Henderson vs. Masvidal,11/28/2015,UFC Fight Night - Henderson vs Masvidal,11/28/2015,,11/28/2015,UFC Fight Night: Henderson vs Masvidal,11/28/2015,
Saturday,2015-11-21,False,False,The Ultimate Fighter Latin America 2 Finale: Magny vs. Gastelum,11/21/2015,The Ultimate Fighter Latin America 2 Finale: Magny vs. Gastelum,11/21/2015,UFC Fight Night - Magny vs Gastelum,11/21/2015,UFC Fight Night 78 - Magny vs. Gastelum,11/21/2015,UFC Fight Night 78: Magny vs Gastelum,11/21/2015,UFC Fight Night 78
Saturday,2015-11-14,False,False,UFC 193: Rousey vs. Holm,11/15/2015,UFC 193: Rousey vs. Holm,11/14/2015,UFC 193 - Rousey vs Holm,11/14/2015,,11/14/2015,UFC 193: Rousey vs Holm,11/14/2015,UFC 193
Saturday,2015-11-07,False,False,UFC Fight Night: Belfort vs. Henderson 3,11/7/2015,UFC Fight Night: Belfort vs. Henderson 3,11/7/2015,UFC Fight Night - Belfort vs Henderson,11/7/2015,UFC Fight Night 77 - Belfort vs. Henderson 3,11/7/2015,UFC Fight Night: Belfort vs Henderson,11/7/2015,UFC Fight Night 77
Saturday,2015-10-24,False,False,UFC Fight Night: Holohan vs. Smolka,10/24/2015,UFC Fight Night: Holohan vs. Smolka,10/24/2015,UFC Fight Night - Holohan vs. Smolka,10/24/2015,,10/24/2015,UFC Fight Night: Holohan vs Smolka,10/24/2015,UFC Fight Night 76
Saturday,2015-10-03,False,False,UFC 192: Cormier vs. Gustafsson,10/3/2015,UFC 192: Cormier vs. Gustafsson,10/3/2015,UFC 192 - Cormier vs. Gustafsson,10/3/2015,UFC 192 - Cormier vs. Gustafsson,10/3/2015,UFC 192: Cormier vs Gustafsson,10/3/2015,UFC 192
Saturday,2015-09-26,False,False,UFC Fight Night: Barnett vs. Nelson,9/27/2015,UFC Fight Night: Barnett vs. Nelson,9/26/2015,UFC Fight Night - Barnett vs. Nelson,9/26/2015,,9/26/2015,UFC Fight Night: Barnett vs Nelson,9/26/2015,UFC Fight Night 75
Saturday,2015-09-05,False,False,UFC 191: Johnson vs. Dodson 2,9/5/2015,UFC 191: Johnson vs. Dodson 2,9/5/2015,UFC 191 - Johnson vs. Dodson 2,9/5/2015,UFC 191 - Johnson vs. Dodson 2,9/5/2015,UFC 191: Johnson vs Dodson 2,9/5/2015,UFC 191
Sunday,2015-08-23,False,False,UFC Fight Night: Holloway vs. Oliveira,8/23/2015,UFC Fight Night: Holloway vs. Oliveira,8/23/2015,UFC Fight Night - Holloway vs. Oliveira,8/23/2015,,8/23/2015,UFC Fight Night: Holloway vs Oliveira,8/23/2015, UFC Fight Night 74
Saturday,2015-08-08,False,False,UFC Fight Night: Teixeira vs. Saint Preux,8/8/2015,UFC Fight Night: Teixeira vs. Saint Preux,8/8/2015,UFC Fight Night - Teixeira vs. Saint Preux,8/8/2015,UFC Fight Night 73 - Teixeira vs. St. Preux,8/8/2015,UFC Fight Night: Teixeira vs Saint Preux,8/8/2015,UFC Fight Night 73
Saturday,2015-08-01,False,False,UFC 190: Rousey vs. Correia,8/1/2015,UFC 190: Rousey vs. Correia,8/1/2015,UFC 190 - Rousey vs. Correia,8/1/2015,,8/1/2015,UFC 190: Rousey vs Correia,8/1/2015,UFC 190
Saturday,2015-07-25,False,False,UFC on Fox: Dillashaw vs. Baro 2,7/25/2015,UFC on Fox: Dillashaw vs. Baro 2,7/25/2015,UFC Fight Night - Dillashaw vs. Barao 2,7/25/2015,UFC on Fox 16 - Dillashaw vs. Barao 2,7/25/2015,UFC on Fox: Dillashaw vs. Barao II,7/25/2015,UFC on FOX 16
Saturday,2015-07-18,False,False,UFC Fight Night: Bisping vs. Leites,7/18/2015,UFC Fight Night: Bisping vs. Leites,7/18/2015,UFC Fight Night - Bisping vs. Leites,7/18/2015,,7/18/2015,UFC Fight Night: Bisping vs Leites,7/18/2015,UFC Fight Night 72
Wednesday,2015-07-15,False,False,UFC Fight Night: Mir vs. Duffee,7/15/2015,UFC Fight Night: Mir vs. Duffee,7/15/2015,UFC Fight Night - Mir vs. Duffee,7/15/2015,UFC Fight Night 71 - Mir vs. Duffee,7/15/2015,UFC Fight Night: Mir vs Duffee,7/15/2015,UFC Fight Night 71
Sunday,2015-07-12,False,False,The Ultimate Fighter: American Top Team vs. Blackzilians Finale,7/12/2015,The Ultimate Fighter: American Top Team vs. Blackzilians Finale,7/12/2015,The Ultimate Fighter Finale - American Top Team vs. Blackzilians,7/12/2015,,7/12/2015,The Ultimate Fighter 21 Finale,7/12/2015,TUF 21 Finale
Saturday,2015-07-11,False,False,UFC 189: Mendes vs. McGregor,7/11/2015,UFC 189: Mendes vs. McGregor,7/11/2015,UFC 189 - Mendes vs. McGregor,7/11/2015,UFC 189 - Mendes vs. McGregor,7/11/2015,UFC 189: Mendes vs McGregor,7/11/2015,UFC 189
